{
  "profileVersion": "1.0",
  "machineId": "simulator",
  "displayName": "Simulator",
  "description": "Local OPC UA simulator machine for development and testing",
  "transport": "opcua",
  "operatingMode": "observe",
  "connection": {
    "endpointUrl": "opc.tcp://localhost:4840",
    "applicationName": "WaraSimulator",
    "security": {
      "mode": "None",
      "policy": "None"
    },
    "authentication": {
      "type": "anonymous"
    },
    "connectionTimeoutMs": 10000,
    "sessionTimeoutMs": 60000,
    "reconnect": {
      "enabled": true,
      "initialDelayMs": 1000,
      "maximumDelayMs": 30000,
      "backoffMultiplier": 2,
      "maxAttempts": 10
    }
  },
  "namespaces": [
    {
      "key": "station",
      "uri": "urn:wara:simulator"
    }
  ],
  "stations": [
    {
      "stationId": "station-a",
      "displayName": "Station A",
      "description": "First assembly station",
      "enabled": true,
      "metadata": {
        "resourceId": "1"
      },
      "signals": [
        {
          "key": "carrierId",
          "role": "carrierId",
          "direction": "machineToMes",
          "namespace": "station",
          "identifier": "ns=1;s=Station1.stMES.Query.uiCarrierId",
          "dataType": "UInt32",
          "access": "read",
          "required": true
        },
        {
          "key": "resourceId",
          "role": "resourceId",
          "direction": "machineToMes",
          "namespace": "station",
          "identifier": "ns=1;s=Station1.stMES.Query.uiResourceId",
          "dataType": "UInt32",
          "access": "read",
          "required": true
        },
        {
          "key": "requestBusy",
          "role": "requestBusy",
          "direction": "mesToMachine",
          "namespace": "station",
          "identifier": "ns=1;s=Station1.stMES.Query.xQryBusy",
          "dataType": "Boolean",
          "access": "write",
          "required": true
        },
        {
          "key": "requestAccepted",
          "role": "requestAccepted",
          "direction": "mesToMachine",
          "namespace": "station",
          "identifier": "ns=1;s=Station1.stMES.Query.xDone",
          "dataType": "Boolean",
          "access": "write",
          "required": true
        },
        {
          "key": "requestRejected",
          "role": "requestRejected",
          "direction": "mesToMachine",
          "namespace": "station",
          "identifier": "ns=1;s=Station1.stMES.Query.xError",
          "dataType": "Boolean",
          "access": "write",
          "required": true
        },
        {
          "key": "orderId",
          "role": "orderId",
          "direction": "mesToMachine",
          "namespace": "station",
          "identifier": "ns=1;s=Station1.stMES.Query.sOrderNo",
          "dataType": "String",
          "access": "write",
          "required": true
        },
        {
          "key": "partNumber",
          "role": "partNumber",
          "direction": "mesToMachine",
          "namespace": "station",
          "identifier": "ns=1;s=Station1.stMES.Query.sPartNo",
          "dataType": "String",
          "access": "write",
          "required": true
        },
        {
          "key": "operationId",
          "role": "operationId",
          "direction": "mesToMachine",
          "namespace": "station",
          "identifier": "ns=1;s=Station1.stMES.Query.uiOperationNo",
          "dataType": "UInt16",
          "access": "write",
          "required": true
        },
        {
          "key": "stepNumber",
          "role": "stepNumber",
          "direction": "mesToMachine",
          "namespace": "station",
          "identifier": "ns=1;s=Station1.stMES.Query.iStepNo",
          "dataType": "Int16",
          "access": "write",
          "required": true
        },
        {
          "key": "nextStationId",
          "role": "nextStationId",
          "direction": "mesToMachine",
          "namespace": "station",
          "identifier": "ns=1;s=Station1.stMES.Query.uiNextResourceId",
          "dataType": "UInt16",
          "access": "write",
          "required": true
        },
        {
          "key": "custom",
          "role": "custom",
          "direction": "mesToMachine",
          "namespace": "station",
          "identifier": "ns=1;s=Station1.stMES.Query.iPar1",
          "dataType": "Int16",
          "access": "write",
          "required": true
        },
        {
          "key": "processResult",
          "role": "processResult",
          "direction": "mesToMachine",
          "namespace": "station",
          "identifier": "ns=1;s=Station1.stMES.Query.uiResultCode",
          "dataType": "UInt16",
          "access": "write",
          "required": true
        },
        {
          "key": "workRequest",
          "role": "workRequest",
          "direction": "machineToMes",
          "namespace": "station",
          "identifier": "ns=1;s=Station1.stMES.Query.xStart",
          "dataType": "Boolean",
          "access": "read",
          "required": true
        },
        {
          "key": "processActive",
          "role": "processActive",
          "direction": "machineToMes",
          "namespace": "station",
          "identifier": "ns=1;s=Station1.stMES.State.xBusy",
          "dataType": "Boolean",
          "access": "read",
          "required": true
        },
        {
          "key": "carrierIdProcess",
          "role": "carrierId",
          "direction": "machineToMes",
          "namespace": "station",
          "identifier": "ns=1;s=Station1.dbProcessData.iCarrierID",
          "dataType": "Int16",
          "access": "read",
          "required": true
        },
        {
          "key": "requestCompleted",
          "role": "requestCompleted",
          "direction": "mesToMachine",
          "namespace": "station",
          "identifier": "ns=1;s=Station1.stMES.Query.xDone",
          "dataType": "Boolean",
          "access": "write",
          "required": true
        },
        {
          "key": "requestRejected",
          "role": "requestRejected",
          "direction": "mesToMachine",
          "namespace": "station",
          "identifier": "ns=1;s=Station1.stMES.Query.xError",
          "dataType": "Boolean",
          "access": "write",
          "required": true
        },
        {
          "key": "cmdStart",
          "role": "custom",
          "direction": "mesToMachine",
          "namespace": "station",
          "identifier": "ns=1;s=Station1.stMES.Control.xCmdStart",
          "dataType": "Boolean",
          "access": "write",
          "required": true
        },
        {
          "key": "cmdStop",
          "role": "custom",
          "direction": "mesToMachine",
          "namespace": "station",
          "identifier": "ns=1;s=Station1.stMES.Control.xCmdStop",
          "dataType": "Boolean",
          "access": "write",
          "required": true
        },
        {
          "key": "cmdReset",
          "role": "custom",
          "direction": "mesToMachine",
          "namespace": "station",
          "identifier": "ns=1;s=Station1.stMES.Control.xCmdReset",
          "dataType": "Boolean",
          "access": "write",
          "required": true
        },
        {
          "key": "cmdPause",
          "role": "custom",
          "direction": "mesToMachine",
          "namespace": "station",
          "identifier": "ns=1;s=Station1.stMES.Control.xCmdPause",
          "dataType": "Boolean",
          "access": "write",
          "required": true
        },
        {
          "key": "legacyStart",
          "role": "custom",
          "direction": "mesToMachine",
          "namespace": "station",
          "identifier": "ns=1;s=Station1.stMES.Query.xStart",
          "dataType": "Boolean",
          "access": "write",
          "required": true
        },
        {
          "key": "legacyQryBusy",
          "role": "custom",
          "direction": "mesToMachine",
          "namespace": "station",
          "identifier": "ns=1;s=Station1.stMES.Query.xQryBusy",
          "dataType": "Boolean",
          "access": "write",
          "required": true
        },
        {
          "key": "legacyDone",
          "role": "custom",
          "direction": "mesToMachine",
          "namespace": "station",
          "identifier": "ns=1;s=Station1.stMES.Query.xDone",
          "dataType": "Boolean",
          "access": "write",
          "required": true
        },
        {
          "key": "legacyError",
          "role": "custom",
          "direction": "mesToMachine",
          "namespace": "station",
          "identifier": "ns=1;s=Station1.stMES.Query.xError",
          "dataType": "Boolean",
          "access": "write",
          "required": true
        }
      ]
    },
    {
      "stationId": "station-b",
      "displayName": "Station B",
      "description": "Inspection station",
      "enabled": true,
      "metadata": {
        "resourceId": "2"
      },
      "signals": [
        {
          "key": "carrierId",
          "role": "carrierId",
          "direction": "machineToMes",
          "namespace": "station",
          "identifier": "ns=1;s=Station2.stMES.Query.uiCarrierId",
          "dataType": "UInt32",
          "access": "read",
          "required": true
        },
        {
          "key": "resourceId",
          "role": "resourceId",
          "direction": "machineToMes",
          "namespace": "station",
          "identifier": "ns=1;s=Station2.stMES.Query.uiResourceId",
          "dataType": "UInt32",
          "access": "read",
          "required": true
        },
        {
          "key": "requestBusy",
          "role": "requestBusy",
          "direction": "mesToMachine",
          "namespace": "station",
          "identifier": "ns=1;s=Station2.stMES.Query.xQryBusy",
          "dataType": "Boolean",
          "access": "write",
          "required": true
        },
        {
          "key": "requestAccepted",